62,"FEDERATION FRANCAISE DU BÂTIMENT","FFB","Organisation professionnelle","http://www2.assemblee-nationale.fr/representant/representant_interet_detail/62","Union de syndicats professionnels (loi de 1884)","http://www.ffbatiment.fr","Porter la parole et les préoccupations des entrepreneurs et artisans du bâtiment au sein du débat public. Défendre les intérêts de la profession. Aider, accompagner les entreprises dans leur développement d'activité. Anticiper les évolutions du secteur, être force de proposition.","Artisanat - Arts et culture - Bâtiment, travaux publics - Consommation et concurrence - Droit des sociétés - Éducation, enseignement, formation - Emploi - Environnement, écologie, développement durable - Fiscalité - Handicap - Immobilier, habitat, logement - Recherche et technologie","Monsieur Bertrand SABLIER (Délégué Général)","Monsieur Benoît VANSTAVEL - Madame Klervi LE LEZ",140695100,10,"Auditions devant les différentes commissions et rapporteurs (PLF, PLFSS, PJL ""Consommation"", PJL ""ALUR"", PJL ""retraites, PJL ""habilitant le gouvernement à prendre des ordonnances dans le secteur de l'urbanisme"") Audiences sollicitées auprès des députés Participation à des tables rondes thématiques",,"La FFB est adhérentes à la CGPME, au MEDEF et à la FIEC (Fédération de l'industrie européenne de la construction).",2012,"59.15 millions d'€",,,"59.15 millions d'€",,,,,,"Entre 30 000 et 40 000 €","Entre 30 000 et 40 000 €",,,164,,,"Personnes morales - Entreprises et artisans du Bâtiment",,57000,"Ce sont les noms des 57 000 entreprises"
159,"Fédération Internationale des Universités Catholiques","FIUC","Organisation non gouvernementale","http://www2.assemblee-nationale.fr/representant/representant_interet_detail/159","Fédération (OING)","http://www.fiuc.org","Sensibiliser les parlementaires à l'action et aux activités de la FIUC Apporter aux élus des éléments d'appréciation sur des sujets universitaires à dominante internationale Faire part d'une expérience de plus de 30ans dans le domaine de l'enseignement supérieur","Agriculture, élevage, pêche, bois - Arts et culture - Coopération et Développement - Éducation, enseignement, formation - Emploi - Environnement, écologie, développement durable - Famille - Gouvernance - Handicap - Jeunesse - Justice et affaires intérieures - Recherche et technologie - Santé","Monsieur Guy-Real Thivierge (Secrétaire Général)","Monsieur Loic Roche - Madame Montserrat Alom Bartroli - Monsieur Nicolas Vergier","(+33) 144395227","4 - La FIUC a un rayonnement international accrédité à l'ONU,à l'UNESCO et au Conseil de l'Europe, ainsi qu'auprès d'agences e l'Union Européennes (EMCDDA) , réseaux Européens (FUCE) divers et à travers le monde grâce a son centre de coordination.","Promouvoir l'enseignement supérieur auprès des élus en leur apportant une expérience de terrain depuis près de 30ans maintenant","La charte des Nations Unies","Appartenance au réseau du comité des OING-UNESCO, UNESCO,ECOSOC, Conseil de l'Europe , autres agences du réseau des Nations-Unies .","","2.00 millions d'€",10000,10000,400000,10000,10000,,,,10000,10000,,,7,,,"Personnes morales - Fédérations (OING) organisation internationale non gouvernementale",,1,"213 universités ou institutions d'enseignement supérieur présentes sur les 5 continents"
55,"Fédération nationale des Activités de Dépollution et de l'Environnement","FNADE","Organisation professionnelle","http://www2.assemblee-nationale.fr/representant/representant_interet_detail/55","Association","http://www.fnade.com","Assurer la veille législative, réglementaire et normative française et européenne, assurer l'animation de colloques et de commissions, représenter les adhérents des syndicats membres auprès des pouvoirs publics, coordonner des actions, communiquer auprès des pouvoirs publics et assurer la défense des intérêts de notre profession.","Environnement, écologie, développement durable","Monsieur Michel VALACHE (Président)","Monsieur Michel VALACHE - Monsieur Vincent LE BLAN - Monsieur Didier IMBERT - Madame Muriel OLIVIER",153043290,"4 - Quatre personnes de manière régulière et 3 à 4 personnes sur des sujets plus particulières","Présentation du projet FNADE pour accélérer durablement le développement de l'industrie du recyclage et de la valorisation des déchets en France - Participation à une audition sur les REP",,"La FNADE est membre de la FEAD, du MEDEF, de l'AFNOR, d'AMORCE, du CNR, du GEIDE et de l'UNSPIC.",2013,"2.10 millions d'€",,,"2.00 millions d'€",96000,6000,,,,"Entre 10 000 et 20 000 €","Entre 10 000 et 20 000 €",,,11,,,"Personnes morales - Notre fédération est composée de 9 syndicats représentant eux-mêmes 283 entreprises regroupant environ 61 000 salariés.",,9,"1) SNAD - Syndicat National des Activités du Déchet 2) GNPMED - Les entrepreneurs de la filière déchet 3) SYPREA - Syndicat des Professionnels du Recyclage en Agriculture 4) UPDS - Union Professionnelle des entreprises de la Dépollution de Sites 5) SYVED - Syndicat pour la Valorisation et l’Élimination des Déchets 6) SVDU - Syndicat national du traitement et de la Valorisation des Déchets Urbains 7) SNIDE - Syndicat National des concepteurs et constructeurs des Industries du Déchet et de l'Environnement 8) FAMAD - Chambre syndicale nationale des Fabricants de Matériels de nettoiement, de collecte et de traitement des Déchets 9) SN2E - Syndicat National des Bureaux d'Etudes Environnement"
84,"Fédération Nationale des Distributeurs, Loueurs et Réparateurs de matériels de bâtiment, travaux publics et manutention","DLR","Organisation professionnelle","http://www2.assemblee-nationale.fr/representant/representant_interet_detail/84","association type lois de 1884 et 1920, sur les syndicats professionnels","http://www.dlr.fr","Représenter et défendre les professions du DLR - Améliorer le professionnalisme et la compétitivité des entreprises - Permettre aux acteurs de la profession de se rencontrer.","Affaires institutionnelles, vie publique - Bâtiment, travaux publics - Budget et finances publiques - Collectivités locales - Commerce, distribution - Droit des sociétés - Éducation, enseignement, formation - Emploi - Environnement, écologie, développement durable - Fiscalité - Industrie - Politique régionale - Transports, logistique","Madame Sonia DUBÈS (Présidente)","Madame Sonia DUBÈS - Madame Florence DUPONT-PRUVOST - Monsieur Hervé REBOLLO - Monsieur Philippe GENET",149893232,4,"","Oui, dans le cadre déontologique propre à notre association professionnelle","ASDM : Association des Syndicats de la Distribution et de la Maintenance des matériels agricoles et manutention et de parcs et jardins ERA (European Rental Association) - Fédération européenne de la location CODINF : Comité de Défense et d'Information Financière",2012,"1.81 millions d'€",,,940000,220000,646000,,,,35000,35000,,,10,,,"Personnes morales - Entreprises",,490,"Liste interne d'entreprises adhérentes"
34,"Fédération nationale des SCoT","FédéSCoT","Organisme public","http://www2.assemblee-nationale.fr/representant/representant_interet_detail/34","association (droit local alsacien-mosellan)","http://www.fedescot.org","La Fédération regroupe les structures publiques (syndicats mixtes et établissements publics) compétents en matière de schémas de cohérence territoriale (SCoT), d’une part pour mettre en réseau et capitaliser les expériences de chacun, et d’autre part pour participer de façon active à la définition et à la mise en œuvre des politiques nationales d’aménagement du territoire","Affaires institutionnelles, vie publique","Monsieur Michel Heinrich (président)","Monsieur Jean-Philippe Strebler","(+33) 01 40 41 84 10",1,"mise au point d'amendements relatifs aux évolutions du droit de l'urbanisme concernant les schémas de cohérence territoriale","Le directeur de la Fédération nationale des SCoT est également représentant d'intérêts au titre de la FédéSCoT auprès du Sénat",,2012,220000,220000,,220000,,,,,,"Entre 0 et 10 000 €","Entre 0 et 10 000 €",,,2,,,,,,
41,"Fédération Nationale des Sociétés d'Intérêt Collectif Agricole d'Electricité","FNSICAE","Organisation professionnelle","http://www2.assemblee-nationale.fr/representant/representant_interet_detail/41","Association loi 1901","http://www.fnsicae.asso.fr","La Fédération Nationale des SICAE représente les intérêts des SICAE dans le domaine de la politique energétique, du marché de l'énergie et des réseaux electriques auprès des Pouvoirs publics européens, nationaux et locaux.","Affaires institutionnelles, vie publique - Agriculture, élevage, pêche, bois - Budget et finances publiques - Collectivités locales - Consommation et concurrence - Énergie, eau - Environnement, écologie, développement durable - Fiscalité - Politique régionale","Monsieur Francesco DELFINI (Secrétaire Général)","Monsieur Pierre BOULNOIS - Monsieur Gérard LEFRANC - Monsieur Christophe CHAUVET - Monsieur Raphael LAUBREAUX - Monsieur Dominique PONCE","(+33) 1 43 26 02 70",6,"La Fédération mène une veille juridique et suit l'ensemble des travaux parlementaires relatifs au secteur de l'énergie. L'an dernier la Fédération en lien les autres Fédérations d'Entreprises locales de distribution d'électricité (UNELEG, ANROC, ELE) ont travaillé sur des amendements sur les textes de loi en discussion.","","Notre Fédération est autonome mais nous travaillons en lien avec les autres Fédérations d'Entreprises locales de distribution d'électricité.",2012,425000,,,360000,60000,3000,,,,"Entre 10 000 et 20 000 €","Entre 10 000 et 20 000 €",,,3,,,"Personnes morales - Sociétés d'Interêt Collectif Agricole d'Electricité",,12,"Aisne 5 rue Ampère BP 20024 02207 BELLEU CEDEX Carmausin 22 rue Raspail BP 81 81400 CARMAUX Ely 33 rue de la Gare 78910 TACOIGNIERES Ferté-Alais (LFA) 14 C avenue Carnot 91590 CERNY Lassigny (SER) Avenue du Parc ZA de Passel BP 20053 60402 NOYON CEDEX Oise 32 rue des Domeliers BP 70525 60250 COMPIEGNE CEDEX Pithiviers (SICAP) 3 rue du Moulin de la Canne BP 458 45304 PITHIVIERS CEDEX Précy-Saint-Martin 28 rue Hautefeuille BP 3 10220 PINEY Est 9 avenue du Lac BP 159 75003 VESOUL CEDEX Saint-Martin-De-Londres 158 allée des Ecureuils 34982 SAINT-GELY-DU FESC CEDEX Sausseron 16 avenue du Carrouge 95760 VALMONDOIS Somme et du Cambraisis 11 rue de la République 80240 ROISEL"
108,"Fédération Nationale des Transports de Voyageurs","F.N.T.V.","Organisation professionnelle","http://www2.assemblee-nationale.fr/representant/representant_interet_detail/108","Organisation professionnelle patronale","http://www.fntv.fr","Fédérant plus de 1500 adhérents, le FNTV est la principale organisation professionnelle du Transport Routier de Voyageurs par autocar. Au travers des missions de la FNTV, l'avenir de la profession se conjugue ainsi : défendre la profession - rassembler ses acteurs - parler et s'engager en leur nom","Affaires institutionnelles, vie publique - Budget et finances publiques - Collectivités locales - Consommation et concurrence - Droit des sociétés - Emploi - Environnement, écologie, développement durable - Fiscalité - Gouvernance - Handicap - Sécurité - Transports, logistique","Monsieur Michel SEYT (Président)","Madame Laurence COUR - Madame Aurélie BRUDER","(+33) 0140826272",4,"Audition sur le contrat intermittent - Loi sur le dialogue social et continuité sur le service public - loi de modernisation de l'action publique et d'affirmation des métropoles",,"MEDEF (via le GITL) - UFT - IRU - IUTP","janvier 2013 à décembre 2013","1.99 millions d'€",,,"1.95 millions d'€",35809,,,,,"Entre 150 000 et 200 000 €","Entre 150 000 et 200 000 €",,,10,,,"Personnes morales - Entreprises de transport par autocar - entreprises de transport par véhicules de moins de 10 places - syndicats régionaux et départementaux",1500,25,"25 syndicats régionaux - 100 syndicats départementaux"
152,"Fédération Nationale Indépendante des Mutuelles","FNIM","Association","http://www2.assemblee-nationale.fr/representant/representant_interet_detail/152","Fédération régie par le Code de la Mutualité","http://www.fnim.fr","Rassembler les mutuelles au premier rang les mutuelles de proximité, en vue de les représenter, de défendre leurs intérêts et de promouvoir les valeurs mutualistes. Participer aux structures officielles concernant le monde la protection sociale, d'être force de propositions dans ce même domaine et de proposer aux mutuelles les formations et les outils indispensables à l'exercice de leur activité.","Banque, Assurance, finances - Budget et finances publiques - Fiscalité - Finances sociales - Gouvernance - Santé","Monsieur Philippe MIXE (Président)","Monsieur Philippe MIXE - Madame Aimée WEBER DEFRANCE","(+33) 01 55 35 31 21",2,"Envoi de courriers aux députés, Rencontres régulières avec les membres de l'Assemblée nationale, Auditions des responsables de la Fnim par les commissions, notamment la commission des Affaires sociales.",,"La FNIM est adhérente de: - L'UNOCAM, Union Nationale des Organismes d'Assurance Maladie, - L'APAC, Association de Promotion de l'Assurance Collective, - Le Fonds CMU, - La Commission des Comptes de la Santé, - Le Conseil de Surveillance de la CNAMTS","",850000,,,560000,210000,80000,,,,60000,60000,,,3,,,"Personnes morales - Les adhérents de la fédération sont des mutuelles, principalement des organismes complémentaires d'assurance santé (OCAM)",,33,"AMPLI, La Mutuelle Aigrefeuille, Just en Famille, GSMC, Santé Just, MFIF, MGD, Mutuelle Saint-Martin, Mutuelle du Rempart, Emoa Mutuelle du Var, Mutuelle santé, Le Ralliement, Mutuelle du Médecin, Mutuelle de Bergerac, SMIP RA, MUTUALP, Mutuelle d'Argenson, MAGE, SMERR, SMEREB, SMECO, Mutuelle des patentés et libéraux de Nouvelle Calédonie, AESM Miltis, UMS, MNA, MACD, MIPOS, Mutuelle de la Police Nationale, Mutuelle Bel Air, Les Mutuelles Ligériennes, MOCF, UITSEM, UNIM."
88,"FONDATION iFRAP",,"Organisme de recherche","http://www2.assemblee-nationale.fr/representant/representant_interet_detail/88","FONDATION RECONNUE D'UTILITE PUBLIQUE","http://www.ifrap.org","La Fondation iFRAP a pour but d'effectuer des études et des recherches scientifiques sur l'efficacité des politiques publiques, notamment celles visant la recherche du plein emploi et le développement économique, de faire connaître le fruit de ces études à l'opinion publique, de proposer des mesures d'amélioration et de mener toutes les actions en vue de la mise en œuvre par le Gouvernement et le Parlement des mesures proposées.","Budget et finances publiques - Collectivités locales - Emploi - Fiscalité - Finances sociales","Monsieur Olivier MITTERRAND (Président)","Madame Agnès Verdier-Molinié - Madame Sandrine Gorreri Buresi - Monsieur Samuel-Frédéric Servière","(+33) 0142332915",3,"Auditions, rendez-vous avec des parlementaires, veille parlementaire sur tous les textes économiques et financiers, débats publics, propositions de réformes et d'ouverture des données publiques dans le sens de l'évaluation des politiques publiques.","Centre Français des Fonds et Fondations - Par nature, la Fondation RUP iFRAP compte un Commissaire du Gouvernement au sein de son Conseil d'administration",,2012,"1.07 millions d'€",,813619,,,257475,,,,"Entre 0 et 10 000 €","Entre 0 et 10 000 €","La Fondation iFRAP, RUP, a l'obligation de publier ses comptes annuels au Journal Officiel",,6,,,"La Fondation iFRAP n'a statutairement pas d'adhérents, mais des donateurs (voir § données financières)",,,"La Fondation iFRAP n'a statutairement pas d'adhérents."
91,"FONDS GOUVERNANCE MONDIALE","F.G.M","Organisation non gouvernementale","http://www2.assemblee-nationale.fr/representant/representant_interet_detail/91","Fonds de dotation","http://www.fondsdegouvernancemondiale.org","Promouvoir les actions de l'O.N.U et de la C.E.E particulièrement celles de l'UNITAR avec qui nous sommes partenaires. Organiser des programmes universitaires de recherches et sensibiliser le public aux organismes européens par des formations, séminaires dont les thématiques recouvrent la gouvernance, les droit de l’homme, la société civile, la responsabilité sociétale et tout ce qui touche a la connaissance des relations internationales.","Affaires institutionnelles, vie publique - Budget et finances publiques - Collectivités locales - Coopération et Développement - Éducation, enseignement, formation - Emploi - Finances sociales - Gouvernance","Monsieur Pierre-Jean GIRE (Président)","Monsieur Sylvain DARGERY - Monsieur Samir ABDELFATAH - Madame Anne-Marie GIRE - Monsieur Pierre-Jean GIRE","(+33) 662648944","10 - Il s'agit de 10 personnes de divers horizons: des universitaires,des experts européens, société civile qui représentent le Conseil d'administration et les domaines d'expertises d'interventions du fonds (Gouvernance-connaissance des institutions, responsabilité sociale d'entreprise,) les thématiques liées à la normalisation des dossiers techniques formations, relation internationale, universitaires société civile.","Groupe d’Intérêt au Sénat Groupe d’intérêt à la C.E.E (conseil Europe) Registre de la transparence à la C.E.E 2013 Participation à la session de formation des Parlementaires Africains. Participation à des travaux d'expertises à la demande de Parlementaires.","L'ensemble des administrateurs se conforme à la charte du Sénat (groupe d’intérêt) au registre transparence de la CEE, de celle des Nations-Unies puisque un de ses rôles est d’être la courroie de transmission de ces valeurs avec respect, le fonds respectera l'éthique de l'Assemblée Nationale.","Le Fonds de Gouvernance est partenaire de l'UNITAR et vise à organiser des sessions de sensibilisation à la réalisation de dossiers internationaux, dossiers de financements européens. Comment les Parlementaires peuvent accéder aux facilités internationales, exemple: prix village UNICEF, messager de la paix .... Le Fonds aide à la réalisation de ces dossiers, à la connaissance des pratiques des institutions. De par sa qualité d'expertise de ses membres le Fonds intervient dans différentes structures, organismes, fédérations (exemple : OPCALIA organisme mutualiste des PMA) au titre de formations specifiques. Le fonds est à l'origine d'une formation conjointe avec l'université sur la gouvernance et sur la gestion de l'humanitaire.","",900000,,150000,75000,175000,400000,,,,49000,49000,"Le fonds a signé des conventions de partenariat et de tutorat avec les grandes école: Polytechnique, HEC, CEDS, Universités Françaises ou chaque fois la transparence est de rigueur Le fonds participe au comité des experts de Transparency International.",,5,,,"Personnes physiques Personnes morales - Entreprises,O.N.G accréditées, collectivités, institutions internationales et européennes. Fédération des Universités Européennes, UNITAR, (Nations-Unies pour la recherche).",500,10,"UNITAR (organisme de formation des Nations-Unies) Mr Rabih Haddad OCHA (intervenant) ONU Mr BARKAT (médiateur responsable de la formation humanitaire) ECOSOC (conseil économique et sociale ONU) Mme Mezoui Consortium de 10 Universités : Londres, Vienne, Oslo, Berlin, Florence, Strasbourg, Nanterre, Nice.,Sarajevo,Casablanca. FIUC (fédération internationale des Universités catholiques) BANQUE MONDIALE (Marseille Mr Lavinal) Conseil de l'Europe attente en cours du statut ONG participatif. UNESCO Mr Haddad ancien Président de la Sorbonne Ambassades (Institut relations internationales de Pekin) Conseil Pontifical pour la culture Rome Mgr Poupard"
147,"France Energie Nouvelle","FEN","Association","http://www2.assemblee-nationale.fr/representant/representant_interet_detail/147","association","http://www.france-energie-nouvelle.com","Rassembler des start-up et PME innovantes dans les éco-technologies (cleantech) pour les représenter auprès des pouvoirs publics de sorte à favoriser un cadre d'action qui permette la réprésentativité des jeunes entreprises vertes des filières industrielles ou de services représentées, lesquelles filières ont toutes pour objectif de réduire l'impact des activités humaines sur l'environnement.","Commerce, distribution - Consommation et concurrence - Coopération et Développement - Énergie, eau - Environnement, écologie, développement durable - Industrie - Politique régionale - Recherche et technologie - Télécommunications - Transports, logistique","Monsieur Frédéric Utzmann (Président)","Madame Alice Jubeau","(+33) 180887500","2000 - L'association regroupe une cinquantaine d'entreprises et plus de 2000 emplois dans les cleantech et représentent les filières : améliorer la gestion de l’eau, des déchets et de l’environnement (filière environnement) ; produire, stocker et transporter des énergies renouvelables et sobres en carbone (filière énergie) ; économiser de l’énergie et construire des bâtiments durables (filière efficacité énergétique) ; optimiser la logistique et les déplacements (filière transports) ; ou, enfin, produire des biens industriels avec un minimum de matières premières et d'impacts environnementaux (filière matériaux).","L'association s'est massivement mobilisée l'an passé dans le cadre du débat sur la Transition Energétique, puis le projet de transposition de la Directive 2012/27/UE notamment, et a soutenu les initiatives des Mardis de l'Avenir. L'association a ainsi mis en place un évènement ""le Cleantech 2013"" pour rassembler les idées et particularismes de chacun et ainsi construire une vision commune partagée pour aider les PME et jeunes entreprises qui participent de la croissance verte et trouver des relais d'idées et des forces pour construire des cadres de concertation qui puissent effectivement donner la voix à ces entreprises et ensuite aider au développement de politiques publiques idoines à leurs besoins.",,,"",35000,,,25000,,10000,,,,5000,5000,,,2,,,"Personnes morales - Entreprises",,52,"Entreprises privées du cleantech (services et ecotechnologies) comme ENERTIME (smart grids), Canibal (biomasse) Liste complète fournie par papier et à disposition au besoin"
166,"France Nature Environnement","FNE","Association","http://www2.assemblee-nationale.fr/representant/representant_interet_detail/166","Association","http://www.fne.asso.fr/","France Nature Environnement est la fédération française des associations de protection de la nature et de l'environnement. C'est la porte-parole d'un mouvement de 3000 associations, regroupées au sein d'une centaine d'organisations adhérentes, présentes sur tout le territoire français, en métropole et outre-mer.","Agriculture, élevage, pêche, bois - Énergie, eau - Environnement, écologie, développement durable - Transports, logistique","Monsieur Bruno Genty (Président)","Madame Morgane Piederriere",144086415,"60 - Le nombre ci-dessous est approximatif (nombre de salariés de FNE et des membres du Conseil d'administration). Les représentations peuvent également être effectuées par des bénévoles de FNE selon leurs sujets d'expertise.","FNE contacte les députés pour leur faire part de ses positions et propositions dans le cadre d'examen de projets et propositions de loi, des missions parlementaires ou des commissions d'enquête.","Le registre des représentants d'intérêts de l'Union Européenne.","FNE est membre des fédérations européennes suivantes: le Bureau Européen de l'Environnement, Transports & Environment et Seas at risks.","","3.46 millions d'€","1.47 millions d'€",343317,153568,223236,"1.27 millions d'€",,,,"Entre 100 000 et 150 000 €","Entre 100 000 et 150 000 €",,,39,,,"Personnes morales - Associations",,3000,"FNE fédère environ 3000 associations de protection de la nature et de l'environnement. Seules 50 fédérations régionales sont adhérentes directes, ainsi que 14 associations nationales."
