197,"MAX HAVELAAR FRANCE",,"Organisation non gouvernementale","http://www2.assemblee-nationale.fr/representant/representant_interet_detail/197","Association loi 1901","http://www.maxhavelaarfrance.org","Gérer et promouvoir le label Fairtrade/Max Havelaar auprès des entreprises et de sensibiliser l'opinion publique française au commerce équitable, pour participer à l'amélioration de la vie des producteurs du Sud et de leurs communautés.","Agroalimentaire - Coopération et Développement - Environnement, écologie, développement durable","Madame Marianne ERNOULT (Présidente)","Madame Marianne ERNOULT - Madame Anne-Marie BERTHIER","(+33) 01 42 87 70 21",2,"Audition dans le cadre de la mission consacrée aux signes de qualité.",,"L'Association Max Havelaar France est membre de l'ONG internationale, Fairtrade International (siège à Bonn, Allemagne). Max Havelaar France est adhérente à la PFCE (Plateforme Française du Commerce Equitable), de l'UDA (Union des Annonceurs), de l'ARPP (Autorité de Régulation de la Publicité), de Coordination Sud, du CRID, de la Semaine de la Solidarité Internationale (SSI).","","3.91 millions d'€",100000,,1012,"3.81 millions d'€",,,,,"Entre 10 000 et 20 000 €","Entre 10 000 et 20 000 €",,,25,,,"Personnes physiques Personnes morales - Entreprises, fédérations, associations",25,19,"Acesa, Alter Eco - Distriborg, Bayeux CE, Bretagne CENS, CEL 92, Champagne-Ardennes Equitable, CLAC, FAIR[e], Fairtrade Africa, FSC France, ISCPA, Les Rencontres du Mont-Blanc, Lobodis, Malongo, NAPP, Paris Equitable, Val d'Oise Equitable, YPCEL, NAPCE"
65,"MBDA FRANCE","MBDA","Entreprise","http://www2.assemblee-nationale.fr/representant/representant_interet_detail/65","SAS","http://www.mbda-systems.com","MBDA EST LE LEADER EUROPEEN DES SYSTEMES DE MISSILES","Défense, armement","Monsieur ANTOINE BOUVIER (PRESIDENT)","Madame PATRICIA CHOLLET","(+33) 1 71 54 10 00","1 - UNE SEULE PERSONNE PARTICIPE AUX ACTIVITES QUI RELEVENT DU CHAMP D'APPLICATION DU REGISTRE DES REPRESENTANTS D'INTERET POUR MBDA.","TRAVAUX D'INFORMATION A L'ATTENTION DES ELUS SUR LES PROBLEMATIQUES LIEES A L'INDUSTRIE TRAVAILLANT POUR LA DEFENSE NATIONALE.","MBDA A ELABORE UNE CHARTE ETHIQUE INTERNE DESTINEE A CHACUN DE SES SALARIES.","GIFAS - GICAT - GICAN - CIDEF",2012,"supérieur à 10 000 000 €",,,,,,"supérieur à 10 000 000 €",,,"Entre 0 et 10 000 €","Entre 0 et 10 000 €",,,9700,4500,5200,,,,
59,"Mouvement des entreprises de France","MEDEF","Organisation professionnelle","http://www2.assemblee-nationale.fr/representant/representant_interet_detail/59","Association loi 1901","http://www.medef.com","1°) Contribuer à un dialogue social constructif au niveau national interprofessionnel, dans les entreprises et leurs organisations professionnelles 2°) Définir et faire connaître le point de vue des entrepreneurs sur les sujets concernant directement ou indirectement les entreprises, afin qu'elles bénéficient d'un environnement législatif et réglementaire favorable 3°) Favoriser la liberté d'entreprendre, promouvoir et diffuser l'esprit d'entreprise dans toutes les composantes de la société","Affaires institutionnelles, vie publique - Audiovisuel et médias, économie numérique - Budget et finances publiques - Commerce, distribution - Consommation et concurrence - Droit des sociétés - Éducation, enseignement, formation - Emploi - Énergie, eau - Environnement, écologie, développement durable - Famille - Fiscalité - Finances sociales - Gouvernance - Handicap - Immobilier, habitat, logement - Industrie - Recherche et technologie - Santé","Monsieur Michel GUILBAUD (Directeur général)","Monsieur Guillaume RESSOT",153591919,5,"1°) Participation aux nombreuses auditions officielles des commissions permanentes, des missions d'information, de la MEC, de la MECSS et du CEC 2°) Organisation de RV avec les députés, les administrateurs des commissions, les secrétariats des groupes politiques en amont des débats parlementaires 3°) Diffusion des prises de position et des propositions du MEDEF","Le MEDEF adhère: Au Code de gouvernance d'entreprise AFEP-MEDEF A la Charte réseaux sociaux, vie privée, internet et recrutement (A compétence égale) A la Charte du mécénat d'entreprise (ADMICAL) A la Charte de la Diversité A la Charte de la Parentalité Au Registre de transparence de l'Union européenne Au Code de déontologie de l'Assemblée nationale",,2012,"37.85 millions d'€",,,"24.00 millions d'€","12.94 millions d'€",870000,,,,600000,600000,"Financement du MEDEF : Cotisations des adhérents (63,5 %) Fonds paritaires (34 %) Produits et placements (2,5 %)",,187,,,"Personnes morales - Fédérations professionnelles",,750000,"Liste des principales fédérations adhérentes : Association nationale des industries agro-alimentaires (ANIA)/ Comité des constructeurs et fabriquants d'automobiles (CCFA)/ Groupement des industries françaises aéronautiques et spatiales (GIFAS)/ Fédération bancaire française (FBF) / Fédération du commerce et de la distribution (FCD)/ Fédération des entreprises de la Beauté (FEBEA)/ Fédération des entreprises de la propreté (FEP)/ Fédération des entreprises de services à la personne (FESP)/ Fédération des industries électriques, électroniques et de la communication (FIEEC)/ Fédération des industries mécaniques (FIM)/ Fédération française du bâtiment (FFB)/ Fédération française des sociétés d'assurance (FFSA)/ Fédération française des télécoms (FFT)/ Fédération nationale des travaux publics (FNTP)/ Fédération de la plasturgie et des composites/ Fédération Syntec/ Groupement des industries de transport et de logistique (GITL)/ Les entreprises du médicament (LEEM)/ PRISME (travail temporaire)/ Union française de l'énergie (UFE)/ Union des industries et métiers de la métallurgie (UIMM)/ Union des industries chimiques (UIC)/ Union des industries textile (UIT)"
97,"Mutuelle Interiale",,"Entreprise","http://www2.assemblee-nationale.fr/representant/representant_interet_detail/97","Mutuelle du livre II du code de la Mutualité","http://www.interiale.fr","La Mutuelle Intériale est une mutuelle régie par le livre II du code de la Mutualité, elle assure les risques santé et la prévoyance des fonctionnaires du Ministère de l'Intérieur et des collectivités territoriales. C'est une mutuelle professionnelle qui dispose d'une connaissance précise des métiers, des filières et des risques professionnels des agents publics qu'elle protège. Elle gère également la délégation de service public de la CNAMTS en matière d'assurance maladie des fonctionnaires du Ministère de l'Intérieur.","Banque, Assurance, finances - Santé","Monsieur Pascal Beaubat (Président)","Monsieur Laurent Michel - Madame Catherine Gautier",155319681,"1 - Laurent Michel, directeur des relations extérieures de la Mutuelle Intériale, chargé des relations avec le Parlement, les ministères et les partenaires institutionnels de la Mutuelle Intériale.","audition devant les députés en charge du suivi des projets de loi : -sécurisation de l'emploi -PLFSS -PLF",,"La Mutuelle Intériale est adhérente à la Fédération nationale de la Mutualité française (FNMF). Elle est adhérente également à Mutualité fonction publique (MFP).",2012,"supérieur à 10 000 000 €",,,,,,"supérieur à 10 000 000 €",,,"Entre 0 et 10 000 €","Entre 0 et 10 000 €",,,480,480,"",,,,
86,"Ordre des Avocats de Paris",,"Organisation professionnelle","http://www2.assemblee-nationale.fr/representant/representant_interet_detail/86","Ordre professionnel","http://www.avocatparis.org","Premier barreau de France, l'Ordre des Avocats de Paris est le porte-parole des 25 392 avocats parisiens. Depuis le 1er janvier 2014, l'Ordre est doté d'une direction des Affaires publiques afin d'engager un débat ouvert et régulier avec les pouvoirs publics, les représentants des forces vives et la société civile. Cette innovation répond à une volonté de contribuer au débat public non seulement sur les questions d'accès au droit mais aussi aux grands débats de société.","Affaires institutionnelles, vie publique - Banque, Assurance, finances - Budget et finances publiques - Consommation et concurrence - Droit des sociétés - Famille - Fiscalité - Gouvernance - Justice et affaires intérieures - Professions libérales - Sécurité","Monsieur Pierre-Olivier SUR ( Bâtonnier de Paris)","Monsieur Pierre-Olivier SUR - Monsieur Laurent MARTINET - Monsieur Louis DEGOS - Monsieur Nicolas CORATO - Madame Amélie GUIRAUD","(+33) (0) 1 80 27 22 71",5,"Rien à signaler","L'Ordre des Avocats de Paris obéit aux règles de déontologie prévues par le Règlement Intérieur National ( RIN de la profession d'avocat) ainsi que le Règlement Intérieur du Barreau de Paris (RIBP)",,2013,"59.80 millions d'€",,,"22.94 millions d'€","32.59 millions d'€","4.26 millions d'€",,,,"Entre 1 000 000 et 1 250 000 €","Entre 1 000 000 et 1 250 000 €",,,200,,,"Personnes physiques - Avocats",25392,,"Rien à signaler"
130,"Partager la Croissance","GEO PLC","Entreprise","http://www2.assemblee-nationale.fr/representant/representant_interet_detail/130","SAS","http://www.geoplc.com","Société de service en efficacité énergétique conseil en économie d'énergie","Affaires institutionnelles, vie publique - Agriculture, élevage, pêche, bois - Artisanat - Bâtiment, travaux publics - Collectivités locales - Énergie, eau - Environnement, écologie, développement durable - Immobilier, habitat, logement - Politique régionale","Monsieur christophe fevrier (président)","Madame Roxane Perrault - Monsieur Hugues Sartre","(+33) 146378861",2,"pas d'activités l'année précédente","Aucune adhésion","membre de : Comité 21 Association 4 D","1 er janvier 2013 au 31 décembre 2013","supérieur à 10 000 000 €",,,,,,"supérieur à 10 000 000 €",,,"Entre 50 000 et 100 000 €","Entre 50 000 et 100 000 €",,,100,100,"",,,,
60,"Pernod Ricard",,"Entreprise","http://www2.assemblee-nationale.fr/representant/representant_interet_detail/60","Société Anonyme","http://www.pernod-ricard.com","Production et distribution de vins et spiritueux","Agroalimentaire","Monsieur Pierre Pringuet (Directeur Général et Vice-Président du Conseil d'Administration)","Madame Marie Benech - Madame Judith Matharan - Monsieur Bruno Goimier - Monsieur Armand Hennon",141004100,2,"En 2012 et 2013, le groupe Pernod Ricard a sollicité des rendez-vous auprès de députés sur les projets et propositions de lois concernant son activité.","Code de l'association professionnelle des responsables des relations avec les pouvoirs publics (ARPP) Lobbying guidelines Pernod Ricard","Association Française des Entreprises Privées (AFEP) Fédération Française des Spiritueux (FFS) Association Nationale des Industries Alimentaires (ANIA) Union des Annonceurs (UDA) Entreprise & Prévention Institut de Liaison et d'Etudes des Industries de Consommation (ILEC)","Exercice fiscal 01/07/2012-30/06/2013","8.58 milliards d'€",,,,,,"8.58 milliards d'€",,,"Entre 30 000 et 40 000 €","Entre 30 000 et 40 000 €","Adhérent à Transparency International France",,18608,2865,15743,,,,
90,"Planèt'AIRport","A.I.R","Association","http://www2.assemblee-nationale.fr/representant/representant_interet_detail/90","Association loi 1901","http://www.plantairport.com","Planèt'AIRport est un groupement associatif soutenu par les Aéroports de paris, dans le cadre de sa RSE qui a pour objectif de mener des actions prioritaires dans les domaine de l'emploi. Plus de 1000 entreprises implantés sur le sites d'Orly, Roissy Charles de Gaulle, le Bourget, renforcent le dispositif développé par Planèt'AIRport dans les domaines , de la RSE, la formation professionnelle, l'aide au logement, la mobilité, l'insertion (IAE). Fair connaitre des actions de terrain bénéficiant du pole d'activités des ADP.","Affaires institutionnelles, vie publique - Arts et culture - Collectivités locales - Coopération et Développement - Éducation, enseignement, formation - Emploi - Environnement, écologie, développement durable - Finances sociales - Gouvernance - Handicap - Immobilier, habitat, logement - Jeunesse - Politique régionale - Recherche et technologie - Sécurité - Transports, logistique","Monsieur Didier Hamon (Président)","Monsieur Patrick Dugard - Monsieur Ludwig Dugard - Monsieur Didier Hamon - Madame Christelle Dubois",670560444,"10 - Il s'agit des membres du C.A mais également des personnes qualifiées qui agissent sur le terrain et représentent les 10 activités de l'association: l'emploi, la résponsabilité sociètalede l'entreprise, la mobilité, le logement, l'insertion par la formation pro, les expert, la sociétés civile.","Planèt'AIRport, de par son ancrage sur le terrain spécifique a été souligné comme ""initiative exemplaire par le Global Compact ONU"" D'autre par le Fonds de dotation A.D.I.F.E membre de Planèt'AIRport a été cité comme Fondation territoriale exemplaire de par son activité son positionnement relevant de la politique de la ville et sa gouvernance incluant les élus.","Charte du pacte Mondial 2005 (ONU) Trophée RSE 2013 (relations avec les parties prenantes) Charte entreprises et quartiers du Ministère de la ville. Agrée par l'Etat structure d'insertion par l'activité économique.","Planèt'AIRport bénéficie du réseau des Aéroports de Paris et de tout le système mis en place en faveur de l'insertion, de l'égalité des chances et oeuvre pour cela depuis 1996. Planèt'AIRport contribue à satisfaire l'obligation de service public statutairement fixé à ADP. Membre du réseau des entreprises signataire de l'engagement de la charte entreprises et quartiers de l'Etat. Membre de C.F.F, I.M.S club RSE des entreprises responsables.","","1.50 millions d'€",800000,400000,150000,50,150000,,,,50000,50000,"La Fondations A.D.P sous l'égide de la Fondation de France doté de 650KF agit en synergie avec Planèt'AIRport également subventionné a hauteur de 330KF",,30,,,"Personnes physiques Personnes morales - Collectivités territoriales, Région Paris Ile de France, Conseils généraux du Val d'Oise, de Seine Saint Denis, du Val de Marne, de Seine et Marne et de l'Essonne. Les missions locales relevant des département sus citée, pole emploi, maison de l'emploi ,PLIS,CCAS,ADMICAL, FACE Fondation de France, Centre Français des Fonds et Fondations.",2000,50,"Aéroports de Paris (Hamon Didier) L'UNITAR (Nations-Unies pour la recherche et la formation) L'Europe (statut ONG participatif en cour ) Universités (consortium Européen en lien avec l'IHENU) Conseil économique et social ONU (demande en cour) Organisme paritaire (FASTT) Région Ile de France , conseiller généraux, organisme d'insertions."
189,"PSA Peugeot Citroën","PSA","Entreprise","http://www2.assemblee-nationale.fr/representant/representant_interet_detail/189","Société Anonyme","http://www.psa-peugeot-citroen.com","Constructeur automobile français regroupant près de 200 000 collaborateurs dans des implantations industrielles et commerciales réparties à travers le monde. Entreprise innovante, PSA Peugeot Citroën a fait de la R&D, la clé de sa stratégie et est pleinement engagé dans une démarche de responsabilité sociale et environnementale en tant qu'acteur de ses territoires d'implantation.","Industrie - Recherche et technologie","Monsieur Olivier BOURGES (Secrétaire Général)","Madame Mathilde LHEUREUX - Monsieur Christian PEUGEOT","(+33) 01 40 66 55 11",2,"Rendez-vous avec des députés, suivi des travaux parlementaires, participation à des auditions, visites de sites éventuelles.","Charte éthique PSA Peugeot Citroën Code de conduite PSA dédié aux relations institutionnelles Inscription sur le registre européen de transparence via l'ACEA Respect des exigences éthiques formalisées par des accords internationaux (Accord cadre mondial sur la Responsabilité Sociale de l'Entreprise, Pacte Mondial des Nations Unies)","CCFA, ACEA, ANFAC, SMMT, VDIK, MEDEF, AFEP, Fondation: Fondation Sécurité Routière Association: AVERE Pôles de compétitivité en R&D automobile: MOVEO",2013,"supérieur à 10 000 000 €",,,,,,"supérieur à 10 000 000 €",,,"Entre 100 000 et 150 000 €","Entre 100 000 et 150 000 €",,,194682,83930,110752,,,,
3,"PUBLICAP CONSEIL",,"Consultants agissant en qualité d'indépendants","http://www2.assemblee-nationale.fr/representant/representant_interet_detail/3","SELARL","http://www.publicap-conseil.fr","conseiller et accompagner les entreprises, groupements professionnels, organismes privés ou publics et associations à promouvoir leurs intérêts auprès de la Représentation nationale","Affaires institutionnelles, vie publique - Agriculture, élevage, pêche, bois - Bâtiment, travaux publics - Banque, Assurance, finances - Collectivités locales - Consommation et concurrence - Énergie, eau - Environnement, écologie, développement durable - Finances sociales - Industrie - Professions libérales - Transports, logistique","Monsieur Pascal BRINDEAU (Gérant)","Monsieur Pascal BRINDEAU","(+33) (0)6 82 48 50 09",1,"Aucune: société créée en 2012",,,2013,"inférieur à 50 000 €",,,,,,,"Affaires institutionnelles, vie publique - inférieur à 50 000 € - Énergie, eau - inférieur à 50 000 €","inférieur à 50 000 €",,"inférieur à 50 000 €",,"JPEE, développeur d'énergies renouvelables Equilibre Centre, entreprise de services à la personne",1,,,,,,
156,"Publicis Consultants",,"Cabinets de consultants spécialisés","http://www2.assemblee-nationale.fr/representant/representant_interet_detail/156","Société Anonyme","http://www.publicis-consultants.fr","Fondée en 1993, Publicis Consultants est l'agence, en France, de conseil en réputation durable de MSLGROUP, le réseau mondial de communication stratégique et d'engagement de Publicis Groupe. Notre agence dispose notamment d'une équipe spécialisée en affaires publiques, relations institutionnelles, représentation d'intérêts, et conseille dans ces domaines principalement des entreprises et associations ou fédérations professionnelles.","Agriculture, élevage, pêche, bois - Agroalimentaire - Audiovisuel et médias, économie numérique - Banque, Assurance, finances - Budget et finances publiques - Collectivités locales - Commerce, distribution - Consommation et concurrence - Éducation, enseignement, formation - Emploi - Énergie, eau - Environnement, écologie, développement durable - Fiscalité - Finances sociales - Immobilier, habitat, logement - Industrie - Santé - Sport, loisirs, tourisme - Télécommunications - Transports, logistique","Monsieur Fabrice Fries (Président)","Monsieur Benjamin Martin - Madame Floriane Delandre - Monsieur Mathieu Slama - Madame Justine Roubaud - Madame Claire Guilhot","(+33) 0144824500",11,"Projet de loi ALUR (rencontres) ; - Projet de loi Consommation (rencontres) ; - Projets de lois de finances et de financement de la sécurité sociale (rencontres) ; - Rapport d'information sur l'impact de la régulation des Telecoms sur la filière Telecom (audition).","Publicis Consultants est signataire de la charte de déontologie de l'AFCL","Association Française des Conseils en Lobbying et affaires publiques (AFCL) SYNTEC Conseil en Relations Publics (Syntec RP) Association des Agences-Conseil en Communication (AACC)",2013,"Entre 600 000 et 700 000 €",,,,,,,"Agroalimentaire - Entre 100 000 et 150 000 € - Commerce, distribution - Entre 200 000 et 250 000 € - Énergie, eau - Entre 150 000 et 200 000 € - Immobilier, habitat, logement - Entre 50 000 et 100 000 € - Télécommunications - Entre 100 000 et 150 000 €","Entre 600 000 et 700 000 €",,"Entre 600 000 et 700 000 €",,"Meubles IKEA France Value Retail Services Association Plurience (présidée par Foncia) Lidl France",11,,,,,,
18,"RADIO FRANCE",,"Entreprise","http://www2.assemblee-nationale.fr/representant/representant_interet_detail/18","Société Anonyme à Capitaux Publics","http://www.radiofrance.fr","Radio France est une société de service public de radio diffusion et qui gère les stations de radio publiques en France métropolitaine ainsi que plusieurs formations musicales.","Affaires institutionnelles, vie publique - Audiovisuel et médias, économie numérique - Arts et culture - Éducation, enseignement, formation - Presse, édition","Madame Bérénice RAVACHE (Secrétaire générale)","Monsieur Pierre JACQUEMAIN","(+33) 0156402616","1 - Nouvelle demande : correspond à une prise de fonction.","Il s'agit d'une première demande.",,,2014,"Entre 600 000 et 700 000 €",,,,,,"Entre 600 000 et 700 000 €",,,"","",,,4600,4600,"",,,,
47,"Regards Citoyens",,"Association","http://www2.assemblee-nationale.fr/representant/representant_interet_detail/47","Association loi 1901","http://www.regardscitoyens.org/","Notre association, transpartisane, a pour objet de renforcer l'éducation et l'engagement civique en promouvant par la pratique le libre accès aux données publiques et leur réutilisation, notamment pour des usages citoyens ou de valorisation des institutions. L'association entend notamment réaliser les objectifs suivants : créer des outils citoyens de valorisation et d'évaluation des politiques publiques et de l'action publique : promouvoir les licences libres et les formats ouverts pour les données publiques ; ... Les statuts de l'association sont disponibles en ligne : http://www.regardscitoyens.org/documents/RegardsCitoyens-Statuts-v2.pdf","Affaires institutionnelles, vie publique - Audiovisuel et médias, économie numérique - Budget et finances publiques - Collectivités locales - Gouvernance - Justice et affaires intérieures - Politique régionale - Recherche et technologie - Télécommunications","Monsieur néant néant (Conseil d'administration collégial partageant la responsabilité juridique)","Monsieur Christophe Boutet - Monsieur David Gayou - Monsieur François Massot - Monsieur Tangui Morlier - Monsieur Benjamin Oooghe-Tabanou","(+33) 681880298 / 683823466 / 607060907 / 659070845","11 - Tous les membres du Conseil d'administration","En 2013, Regards Citoyens s'est investi dans 3 plaidoyers auprès des parlementaires : - établissement d'un registre obligatoire des lobbyistes permettant de tracer les dépenses et actions des représentants d'intérêts (rencontres vice-président et déontologue, propositions lois transparence) ; - conflits d'intérêts et déontologie de la vie politique : propositions pour les projets de lois pour la Transparence de la vie Politique ; - ouverture des données parlementaires, votes, délégations, ... L'ensemble des plaidoyers et amendements proposés est rendu public à tous en ligne à l'adresse suivante : http://www.regardscitoyens.org/documents/notes/","L'article 9 des statuts de Regards Citoyens encadre la gestion des conflits d'intérêts : ""Un membre ne peut prendre part à une délibération ou un vote lorsque ceux-ci portent sur une décision relative à une autre structure dont il est membre, salarié ou avec laquelle il entretient des liens d'intérêts."" ""Les administrateurs déclarent publiquement leurs intérêts actuels et des 5 dernières années. Le modèle et le mode de déclaration des intérêts est défini par le règlement intérieur.""","Regards Citoyens participe aux activités de plusieurs groupes internationaux : - L'Alliance for Lobbying Transparency and Ethics Regulation (ALTER-EU), coalition de plus de 200 organisations préoccupées par l'influence croissante exercée par les lobbyistes sur l'agenda politique en Europe : http://www.alter-eu.org/ - L'Open Knowledge Foundation (groupe local français), organisation à but non lucratif promouvant la culture libre sous toutes ses formes : http://fr.okfn.org - La coalition Opening Parliament rassemble autour de la Déclaration pour l'Ouverture et la Transparence des Parlements une communauté de plus de 100 organisations dans plus de 75 pays : http://www.openingparliament.org/","",3380,2570,540,,270,,,,,200,200,"L'essentiel des côuts associables à nos plaidoyers consiste en du temps humain consacré comme bénévoles ainsi qu'aux quelques dépenses de communication, d'électricité ou de frais d'accès à internet pour assurer notre veille, rédiger nos plaidoyers et les faire parvenir aux parlementaires. Quelques dépenses occasionnelles de timbres ou déplacements peuvent également être comptabilisées. Le détail des comptes de l'association est publié en ligne : http://www.nosdonnees.fr/dataset/comptes-de-lassociation-regards-citoyens",,"",,,"Personnes physiques",11,,""
39,"RESEAU FERRE DE FRANCE","RFF","Entreprise","http://www2.assemblee-nationale.fr/representant/representant_interet_detail/39","EPIC","http://www.rff.fr","Gestionnaire d'infrastructure ferroviaire","Budget et finances publiques - Environnement, écologie, développement durable - Immobilier, habitat, logement - Politique régionale - Transports, logistique","Monsieur CHRISTOPHE PIEDNOEL (directeur de la communication, des relations extérieures et de la concertation)","Madame Marie-Reine du BOURG","(+33) 01 53 94 30 00","10 - Essentiellement le Comex","Table-ronde sur le ferroviaire en Ile-de-France, Audition loi de finances 2013 crédits transport, subvention à RFF Audition en commission du développement durable et commission des finances sur le projet de réforme du ferroviaire. Audition groupe de suivi du Grand Paris Audition commission mobilité 21.","RFF a établi une charte de conduite. Je suis adhérente a l'ARPP (Association des Responsables avec les Pouvoirs Publics) qui a établi une charte éthique.","TDIE : Transport Développement Intermodalité Environnement.",2012,5556,,,,,,5556,,,"Entre 50 000 et 100 000 €","Entre 50 000 et 100 000 €",,,1300,1300,"",,,,
