16,"CASINO GUICHARD PERRACHON","GROUPE CASINO","Entreprise","http://www2.assemblee-nationale.fr/representant/representant_interet_detail/16","Société Anonyme","http://www.groupe-casino.fr","Distribution à dominante alimentaire - Vente à distance - Distribution de carburant - Restauration collective - Crédit à la consommation - Promotion immobilière commerciale et foncière","Agroalimentaire - Commerce, distribution","Monsieur Pascal RIVET (Secrétaire général Groupe)","Monsieur Claude RISAC - Madame Muriel MOURNETAS - Monsieur Jean-Luc FECHNER - Monsieur Pierre BOURDEREAU","(+33) 04 77 45 31 31",4,"En 2012 et 2013, le groupe Casino a sollicité des rendez-vous auprès de députés sur les projets et propositions de lois concernant son activité. Le directeur des relations extérieures a participé également a plusieurs auditions dont une organisée par les rapporteurs de la Loi sur la consommation.","Pacte mondial des Nations Unies","Fédération des entreprises du Commerce et de la Distribution (FCD) Fédération du commerce de proximité FEVAD Fédération Française de la Franchise (FFF) AFILOG",2012,"supérieur à 10 000 000 €",,,,,,"supérieur à 10 000 000 €",,,"Entre 0 et 10 000 €","Entre 0 et 10 000 €",,,319700,79700,240000,,,,
85,"Chambre de commerce et d’industrie de région Paris Ile-de-France","CCI Paris Ile-de-France","Organisme public","http://www2.assemblee-nationale.fr/representant/representant_interet_detail/85","Etablissement public placé sous la tutelle de l’Etat","http://www.cci-paris-idf.fr/","La CCI Paris Ile-de-France regroupe les CCI des huit département de la région. Elle a pour fonction de représenter les intérêts de l'industrie, du commerce et des services des 800 000 entreprises de la région dont l'activité contribue pour 25% du PIB national. Elle contribue au développement économique, à l'attractivité et à l'aménagement du territoire. Elle gère 25 écoles qui accueillent 32 400 jeunes et s'est dotée d'une filière d'excellence dans le des congrès et salons.","Audiovisuel et médias, économie numérique - Banque, Assurance, finances - Budget et finances publiques - Commerce, distribution - Consommation et concurrence - Éducation, enseignement, formation - Emploi - Environnement, écologie, développement durable - Fiscalité - Handicap - Hôtellerie, restauration - Immobilier, habitat, logement - Industrie - Jeunesse - Politique régionale - Recherche et technologie - Sport, loisirs, tourisme - Transports, logistique","Monsieur Pierre-Antoine GAILLY (Président)","Madame Véronique ETIENNE-MARTIN",33820012112,2,"La mission consultative de la Chambre de commerce et d’industrie de région Paris Ile-de-France composée d’une cinquantaine d’experts a produit plus de 20 rapports en lien avec l’activité législative du parlement et de la Commission européenne. Elle dispose par ailleurs de centres de recherche spécialisés comme le CREDA (Centre de Recherche sur le Droit des Affaires) ou l’IRPI (Institut de Recherche en Propriété Intellectuelle) qui peuvent apporter un éclairage très spécifique sur les sujets de propriété intellectuelle ou de droit des affaires. http://www.etudes.cci-paris-idf.fr/","Mme Etienne-Martin est membre de l’ARPP (Association Professionnelle des Responsables des Relations avec les Pouvoirs Publics) qui dispose d’un code de déontologie.","Conformément au code de commerce, la CCI Paris Ile-de-France est représentée au sein de CCI France, établissement public qui regroupe l'ensemble des établissements du réseau consulaire français.",2013,"731.00 millions d'€","365.50 millions d'€",,,,,,,,"Entre 250 000 et 300 000 €","Entre 250 000 et 300 000 €",,,5200,,,,,,
40,"Chambre Syndicale Française de la Levure","CSFL","Syndicat","http://www2.assemblee-nationale.fr/representant/representant_interet_detail/40","Syndicat","http://www.chambresyndicalelevure.com","Représenter les producteurs de levures et de micro-organismes de fermentation (fabriqués dans l'Union Européenne et commercialisées en France). Les applications de la levure sont nombreuses : pain, vin, bière mais aussi alimentation animale.","Affaires institutionnelles, vie publique - Agriculture, élevage, pêche, bois - Agroalimentaire - Artisanat - Budget et finances publiques - Consommation et concurrence - Énergie, eau - Environnement, écologie, développement durable - Fiscalité - Industrie - Recherche et technologie - Santé - Transports, logistique","Monsieur Stéphane LACROIX (Président)","Monsieur Emmanuel GUICHARD","(+33) 0145085482","1 - Emmanuel GUICHARD (Secrétaire Général)","rencontre avec des parlementaires - présence dans les tribunes du public","Emmanuel GUICHARD, en tant que Secrétaire Général de l'association Europeenne COFALEC, est inscrit au registre des représentants d'intérêt Européen depuis 2008. Accréditation: 207 339 0649 _79","En France, la CSFL est une fédération adhérente à l'ANIA (www.ania.net). En Europe, la CSFL adhère au COFALEC (Confédération des Fabricants de Levure de l'Union Européenne, www.cofalec.com)",2012,235520,,,230520,,5000,,,,"Entre 0 et 10 000 €","Entre 0 et 10 000 €",,,4,,,"Personnes morales - Les adhérents de notre syndicat sont les entreprises couvertes par notre concention collective. Ce sont des producteurs de levure.",,5,"AB Mauri, Société Industrielle Lesaffre, SIL-FALA, Bio-Springer, Lallemand"
173,"Cité de la musique/ Salle Pleyel",,"Organisme public","http://www2.assemblee-nationale.fr/representant/representant_interet_detail/173","EPIC","http://www.citedelamusique.fr","Diffusion de concerts/conception d'expositions/développement d'une politique éducative musicale","Arts et culture","Monsieur Laurent Bayle (Directeur général)","Madame Clara Wagner",144844780,1,"Suivi des débats budgétaires/projet de loi création (avec la création du statut de la Philarmonie de Paris)",,,2013,"39.60 millions d'€","25.00 millions d'€",,,,,,,,"Entre 0 et 10 000 €","Entre 0 et 10 000 €",,,298,,,,,,
185,"CLAI L'ALTERNATIVE CORPORATE","CLAI","Cabinets de consultants spécialisés","http://www2.assemblee-nationale.fr/representant/representant_interet_detail/185","SAS","http://www.clai-communications.com/","Accompagner nos clients dans les projets et situations sensibles, les aider à définir leur identité corporate et à promouvoir leur image.","Agriculture, élevage, pêche, bois - Agroalimentaire - Banque, Assurance, finances - Collectivités locales - Commerce, distribution - Défense, armement - Énergie, eau - Environnement, écologie, développement durable - Fiscalité - Finances sociales - Industrie - Politique régionale - Santé - Sécurité - Transports, logistique","Monsieur Eric GIUILY (Président)","Monsieur Eric GIUILY - Madame Isabelle MAS - Monsieur Dominique BUR - Monsieur Gaëtan COMMAULT - Monsieur Teoman BAKOGLU","(+33) 01 44 69 54 00","Nos missions sont le plus souvent larges et dépassent le champ d'application du registre des représentants d'intérêt qui n'en est qu'un aspect. Tous nos consultants (18) peuvent être amenés à participer à ces dernières activités.","Conséquences de l'affaire Cahuzac sur l'un de nos clients - Application au logement intermédiaire des différents régimes de défiscalisation - Mesures concernant les laboratoires pharmaceutiques et l'industrie agroalimentaire dans le PLS, le PLFSS et les PLFR - Modalités de remboursement des frais d'optique - Cyber défense.","Charte éthique de l'AFCL","Association des Agences-Conseils en Communication (AACC) Association des Conseils en Lobbying et Affaires Publiques (AFCL)",2013,"Entre 1 000 000 et 1 250 000 €",,,,,,,"Agroalimentaire - Entre 50 000 et 100 000 € - Banque, Assurance, finances - Entre 100 000 et 150 000 € - Commerce, distribution - Entre 50 000 et 100 000 € - Défense, armement - Entre 50 000 et 100 000 € - Environnement, écologie, développement durable - Entre 50 000 et 100 000 € - Fiscalité - Entre 50 000 et 100 000 € - Finances sociales - Entre 50 000 et 100 000 € - Justice et affaires intérieures - Entre 100 000 et 150 000 € - Santé - Entre 150 000 et 200 000 € - Sécurité - Entre 50 000 et 100 000 € - Transports, logistique - Entre 50 000 et 100 000 €","Entre 1 000 000 et 1 250 000 €",,"Entre 1 000 000 et 1 250 000 €",,"EN 2014 : - Qosmos - Lilly France - Nestlé France - Altéo - Groupe Salins - Air Liquide groupe + diverses filiales France - Oberthur Technologies - GMP Groupe Moulins de Paris - E.ON SME - Valdunes - France Territoire Solaire - Soper - Fédération des Promoteurs Immobiliers de la Réunion - SOPER","Nos missions sont le plus souvent larges et dépassent le champ d'application du registre des représentants d'intérêt qui n'en est qu'un aspect. Tous nos consultants (18) peuvent être amenés à participer à ces dernières activités.",,,,,,
160,"Club DD",,"Entreprise","http://www2.assemblee-nationale.fr/representant/representant_interet_detail/160","NC","http://www.clubdd.fr","Le Club DD est un portail d'informations media et réseaux permettant à tous les acteurs impliqués dans le développement durable de se côtoyer et de se tenir informés sur l'actualité et l'innovation de leur secteur.","Affaires institutionnelles, vie publique - Agriculture, élevage, pêche, bois - Agroalimentaire - Artisanat - Bâtiment, travaux publics - Collectivités locales - Consommation et concurrence - Coopération et Développement - Énergie, eau - Environnement, écologie, développement durable - Famille - Finances sociales - Gouvernance - Handicap - Politique régionale - Recherche et technologie - Santé - Transports, logistique","Monsieur Louis DAVIN (Gérant)","Monsieur Louis DAVIN - Madame Karine BERTHIER - Madame Maja JOKIC-TAILLEUX - Madame Séverine OGER - Madame Mathilde ROCHE",144949560,5,"Invitation aux petits déjeuners organisés par le Club DD sur les questions liées au Développement Durable. Sollicitation de parlementaires pour la mise à disposition des Salons Mars Demande de participation, intervention de parlementaires sur des sujets liés au DD","Code d'Athènes Code de déontologie des attachés de presse Code de Lisbonne",,2013,"",,,,,,"",,,"","","Le Club DD est une émanation de la société ESCAL Consulting et n'a pas de statut juridique propre",,15,15,"",,,,
2,"CNES","Centre National d'Etudes Spatiales","Organisme public","http://www2.assemblee-nationale.fr/representant/representant_interet_detail/2","Etablissement Public à caractère Industriel et Commercial","http://www.cnes.fr","Le CNES propose au Gouvernement la politique spatiale de la France et la met en oeuvre",,"Monsieur Jean-Yves LE GALL (Président)","Monsieur Pierre TREFOURET - Monsieur Guillaume DE BLANCHARD - Monsieur Guillaume DE BLANCHARD","(+33) 144767500",2,"Organisation d'un petit dejeuner annuel avec les rapporteurs Soutien au Groupe des Parlementaires pour l'Espace",,,2013,"2.00 milliards d'€","2.00 milliards d'€",,,,,,,,200000,200000,"",,2400,,,,,,
109,"Com'Publics",,"Cabinets de consultants spécialisés","http://www2.assemblee-nationale.fr/representant/representant_interet_detail/109","SARL","http://www.compublics.com","Depuis vingt ans, Com’Publics met au service de ses clients son expérience auprès des pouvoirs publics et des élus : gouvernement, parlement, collectivités locales, institutions... De la réflexion stratégique à l’élaboration de documents en passant par la création et la gestion d’événements, de la sensibilisation des parlementaires aux entretiens dans les ministères, l’agence mobilise l’ensemble de ses compétences pour atteindre les objectifs de lobbying ou de communication de ses clients. • Conseil en communication institutionnelle s’appuyant sur une connaissance précise du milieu politique, institutionnel et territorial. • Lobbying actif (suivi législatif, organisation de rencontres et de rendez-vous ciblés, tables rondes, veille). • Création de supports (journaux, newsletters, chartes graphiques, logos, cartes de vœux…). Com’Publics est particulièrement reconnue pour son animation de clubs thématiques et think tank.","Agriculture, élevage, pêche, bois - Agroalimentaire - Artisanat - Banque, Assurance, finances - Environnement, écologie, développement durable - Fiscalité - Handicap - Hôtellerie, restauration - Immobilier, habitat, logement - Recherche et technologie - Santé - Sport, loisirs, tourisme - Transports, logistique","Monsieur Marc Teyssier d'Orfeuil (Directeur général)","Monsieur Marc Teyssier d'Orfeuil - Monsieur Mathieu la Fay - Madame Angeline Charbonnier - Monsieur Thibaut Moura - Madame Marine Durand-Ruel","(+33) 144181450",15,"Envoi de journaux, invitations, petits-déjéuners, déjeuners ou dîners-débat, prises de RDV.","Com'Publics est membre de l'AFCL, respecte la déontologie et a signé la charte déontologique de l'AFCL.",,2013,"Entre 600 000 et 700 000 €",,,,,,,"Agriculture, élevage, pêche, bois - Entre 100 000 et 150 000 € - Agroalimentaire - Entre 50 000 et 100 000 € - Artisanat - inférieur à 50 000 € - Banque, Assurance, finances - inférieur à 50 000 € - Environnement, écologie, développement durable - Entre 50 000 et 100 000 € - Fiscalité - inférieur à 50 000 € - Handicap - inférieur à 50 000 € - Hôtellerie, restauration - inférieur à 50 000 € - Immobilier, habitat, logement - Entre 50 000 et 100 000 € - Recherche et technologie - inférieur à 50 000 € - Santé - inférieur à 50 000 € - Sport, loisirs, tourisme - inférieur à 50 000 € - Transports, logistique - Entre 50 000 et 100 000 €","Entre 600 000 et 700 000 €",,"Entre 600 000 et 700 000 €",,"ACTA, CIFOG, CNPO, INAPORC, CSEM, SCC, CNETH, FNDLP, Club Autonomie &dépendance - bien vieillir ensemble, Club de l'accession à la propriété, Club bois & forêts, Club du dernier kilomètre de livraison, Club de l'emballage léger en aluminium et en acier, Club France Terre de tourisme, Club Mer & Océan, Club des PPP, Club Produire en France, Club de la Table Française, Club des voitures écologiques.",15,,,,,,
99,"Comité des Salines de France","CSF","Organisation professionnelle","http://www2.assemblee-nationale.fr/representant/representant_interet_detail/99","Syndicat national professionnel (loi 1884)","http://www.salines.com","Le Comité des Salines de France est un syndicat professionnel (loi 1884) qui regroupe les principaux producteurs de sel (chlorure de sodium) établis en France. Il est le porte-parole de la profession salinière concernant toutes les questions ayant trait au sel, à sa production et à ses différentes utilisations. Il a pour principales missions : - de mener une veille active pour ses adhérents, notamment réglementaire, technique et scientifique, - de représenter les intérêts collectifs des producteurs de sel en portant les positions communes des adhérents, - d’être l’interlocuteur privilégié des pouvoirs publics pour la profession salinière française, - de développer un réseau de partenaires aux niveaux national et international avec les secteurs professionnels rassemblant les industries utilisatrices de sel ou ayant des activités en lien avec le sel : traiteurs d’eau, fournisseurs de fondants routiers, industries chimiques, fabricants de compléments pour la nutrition animale, entreprises de l’alimentaire, stockeurs d’énergie en cavités salines, etc., - d’être une source d’information de référence pour tous les publics.","Affaires institutionnelles, vie publique - Agriculture, élevage, pêche, bois - Agroalimentaire - Commerce, distribution - Consommation et concurrence - Énergie, eau - Environnement, écologie, développement durable - Fiscalité - Gouvernance - Industrie - Politique régionale - Recherche et technologie - Santé - Transports, logistique","Monsieur Franck HEURTEBISE (Président)","Monsieur Franck HEURTEBISE - Madame Sarah CLISCI","(+33) 01 47 66 52 90",2,"Dans le cadre de la préparation de la réforme du code minier : - audition par le groupe de travail sur la réforme du code minier de la Commission du Développement durable ; - rendez-vous avec deux parlementaires au Parlement ; - envoi de courriers et d’une présentation.","Conformément aux statuts du Comité des Salines de France, par le seul fait de son adhésion, tout adhérent du Comité des Salines de France prend l'engagement d'honneur, sous peine d'exclusion, de respecter les règles d'honorabilité et d'éthique professionnelles.","Adhérent de l'Association Nationale des Industries Alimentaires (ANIA) - Adhérent du Centre d'Etudes des Directeurs d'Associations Professionnelles (CEDAP) - Membre du Comité de Liaison de l'Association des producteurs de sel européens (EuSalt)",2013,322373,,,305000,17373,,,,,"Entre 0 et 10 000 €","Entre 0 et 10 000 €",,,2,,,"Personnes morales - Les adhérents du Comité des Salines de France sont des entreprises.",,7,"Compagnie des Salins du Midi et des Salines de l'Est - Esco France - Saline d'Einville - Solvay Carbonate France - Novacarb - Storengy - Société Salinière de Provence"
17,"Comité National des Entreprises d'Insertion","CNEI","Autre organisation professionnelle","http://www2.assemblee-nationale.fr/representant/representant_interet_detail/17","Association loi 1901","http://www.cnei.org","Crée en 1988, le Comité National des Entreprises d'Insertion (CNEI) représente les 1260 entreprises d’insertion (EI) et entreprises de travail temporaire d’insertion (ETTI) de France. Celles-ci emploient chaque année 65 000 salariés (dont 55 000 en parcours d’insertion) dans divers secteurs d’activité (collecte, tri, récupération, recyclage des déchets, travail temporaire, services aux entreprises, BTP, environnement et espaces verts, tourisme et restauration…) pour un chiffre d’affaires global de 850 M€. Le CNEI et ses 23 unions régionales représentent ces entreprises auprès de l’Etat et des organisations professionnelles, accompagnent leur développement et mutualisent leurs expériences afin de favoriser l’accès à l’emploi durable des personnes en difficulté sociale et professionnelle.","Affaires institutionnelles, vie publique - Bâtiment, travaux publics - Budget et finances publiques - Emploi - Environnement, écologie, développement durable - Finances sociales - Politique régionale","Monsieur Kenny BERTONAZZI (Président)","Monsieur Kenny BERTONAZZI - Monsieur Olivier DUPUIS - Madame Joséphine LABROUE",153273480,"16 - Kenny Bertonazzi, Président Olivier Dupuis, secrétaire général Joséphine Labroue, chargée de mission Potentiellement, les 13 membres du bureau fédéral, administrateurs du CNEI","Octobre 2012 - Emplois d'avenir : contribution; présentation des propositions au cours d'une réunion à l'Assemblée ; propositions d'amendements - PLF 2013 : contributions écrites ; auditions ; propositions d'amendements - Avril 2013 : réunion de travail sur la réforme de l'IAE - PLF 2014 : contributions écrites ; auditions ; propositions d'amendements - Une dizaine de rencontres avec des députés à l'Assemblée - Envoi à tous les députés d'une carte de voeux, d'un document d'information sur les entreprises d'insertion et des Chiffres clés de la fédération - Envoi à certains députés de notes, de contributions et d'une lettre d'information","L'objectif des relations parlementaires de la fédération est de mieux faire connaitre et comprendre le modèle Entreprise d'insertion afin d'activer les leviers pouvant permettre la sécurisation et le développement de leur mission sociale au service des personnes éloignées de l'emploi. En tant qu'association bénéficiant de fonds publics et représentant des entreprises sociales, l'activité de représentation d'intérêt du CNEI se compse de contributions techniques, de l'apport d'expertise et de démarches de sensibilisation auprès des parlementaires et de leurs collaborateurs.","Adhérent au MEDEF en tant que fédération professionnelle Adhérent au MOUVES (Mouvement des entrepreneurs sociaux) Adhérent à l'OBSAR (Observatoire des achats responsables) Adhérent à AMORCE (association nationale des collectivités, des associations et des entrperises pour la gestion des déchets, de l'énergie et des réseaux de chaleur)",2012,"1.05 millions d'€",410000,,536000,60000,46000,,,,"Entre 30 000 et 40 000 €","Entre 30 000 et 40 000 €","L'activité de représentation d'intérêts est exclusivement financée par les cotisations des adhérents à la fédération.",,9,,,"Personnes morales - Entreprises d'insertion et entreprises de travail temporaire d'insertion, reconnues au titre de l'article L. 5132-4 du Code du Travail et conventionnées par l'Etat (DIRECCTE) pour la mission d'insertion auprès des personnes éloignées de l'emploi. Elles sont sous statut associatif, commercial ou coopératif.",,542,"La liste complètes des entreprises adhérentes au CNEI est disponible sur notre site internet."
168,"Commissariat à l'Energie atomique et aux Energies alternatives","CEA","Organisme public","http://www2.assemblee-nationale.fr/representant/representant_interet_detail/168","Etablissement à caractère industriel et commercial","http://www.cea.fr","organisme de recherche technologique : activités de recherche dans les domaines de la défense et de la sécurité globale, des énergies bas carbone, des technologies pour l'information et la santé, des très grands instruments de recherche 10 établissements en France, 4700 publications dans revues à comité de lecture, 4200 familles de brevets actives, 150entreprises technologies créées depuis 1984","Défense, armement - Énergie, eau - Environnement, écologie, développement durable - Industrie - Politique régionale - Recherche et technologie - Santé - Sécurité","Monsieur BERNARD BIGOT (Administrateur général)","Monsieur JEAN-PIERRE VIGOUROUX - Monsieur STEPHANE LAVEISSIERE - Madame ANNE TRICAUD","(+33) 0164501000","1 - les 3 personnes du service des affaires publiques sont toutes à temps partagé sur les relations avec le Parlement, pour un total équivalent à une personne-an.","réponse aux sollicitations multiples des parlementaires : auditions, réunions, visites de centres de recherche, contributions diverses...","le représentant du CEA au parlement est membre de l'association ARPP -association professionnelle des représentants auprès des pouvoirs publics-. L'ARPP applique une charte de déontologie depuis plus de 25 ans",,2012,"4.30 milliards d'€","3.44 milliards d'€",,,"860.00 millions d'€",,,,,"Entre 150 000 et 200 000 €","Entre 150 000 et 200 000 €",,,16100,,,,,,
165,"Commission de régulation de l'énergie","CRE","Autorité administrative","http://www2.assemblee-nationale.fr/representant/representant_interet_detail/165","Autorité administrative indépendante",,"La CRE concourt au bon fonctionnement des marchés de l'électricité et du gaz naturel au bénéfice des consommateurs finals et en cohérence avec les objectifs de la politique énergétique.","Consommation et concurrence - Énergie, eau - Fiscalité","Monsieur Philippe de Ladoucette (Président)","Madame France de Saint-Martin - Madame Anne Monteil",144504100,2,"Auditions par les commissions compétentes, missions d'informations et commissions d'enquêtes. Envoi du rapport annuel de la CRE et des autres publications de la CRE.",,,2013,"18.94 millions d'€","18.94 millions d'€",,,,,,,,"","",,,128,,,,,,
174,"Commission Nationale de l'Informatique et des Libertés","CNIL","Autorité administrative","http://www2.assemblee-nationale.fr/representant/representant_interet_detail/174","Autorité administrative indépendante","http://www.cnil.fr","protection des données personnelles conformément à la loi n°78-17 du 6 janvier 1978 modifiée","Affaires institutionnelles, vie publique - Audiovisuel et médias, économie numérique - Collectivités locales - Éducation, enseignement, formation - Justice et affaires intérieures - Santé - Sécurité","Madame Isabelle FALQUE-PIERROTIN (Présidente)","Madame Tiphaine INGLEBERT",153732222,1,"auditions parlementaires",,"G 29 (groupe des ""CNILs"" européennes)",2013,"16.93 millions d'€","16.93 millions d'€",,,,,,,,"","",,,178,,,,,,
